{
	"dental_health/family_dental_problems": "BB SBG",
	"dental_health/last_6_months_dental_fam_probl": "Y",
	"dental_health/owning_toothbrush": "Y",
	"dental_health/times_brush_teeth_daily": "1",
	"dental_health/used_for_cleaning_teeth": "SL",
	"disability/types_of_disability": "PHY SEN",
	"do_you_consent_AWH": "Y",
	"end": "2019-03-27T11:32:56.335+08:00",
	"family_membership/list_of_family_members": "TEST FAMILY MEMBERSHIP",
	"formhub/uuid": "cce709e26c584038a00cc6decb3b68ca",
	"health_information/alcohol_within_week": "30",
	"health_information/blood_pressure_1st_diastole": "80",
	"health_information/blood_pressure_1st_systole": "120",
	"health_information/blood_pressure_2nd_diastole": "80",
	"health_information/blood_pressure_2nd_systole": "120",
	"health_information/considering_self_with_disabili": "Y",
	"health_information/diagnosed": "CAN KID RES",
	"health_information/exercise_within_week": "2_to_3_hours",
	"health_information/family_history": "CAN DIAB HYP",
	"health_information/fruits_within_week": "1",
	"health_information/has_health_insurance_plan": "YPH",
	"health_information/height": "70",
	"health_information/how_taking_prescribed_dose": "PNT",
	"health_information/smoking_habit": "NO",
	"health_information/taking_long_term_meds": "Y",
	"health_information/times_exposed_to_t_smoke": "12",
	"health_information/traditional_medicine": "NO",
	"health_information/travel_for_medicine": "WHR",
	"health_information/vegetable_within_week": "2",
	"health_information/waist_circumference": "33",
	"health_information/weight": "60",
	"household/amenities": "WAT",
	"household/ensuring_water_is_safe": "FI",
	"household/house_construction": "WB",
	"household/mostly_used_to_wash_hands": "CWP",
	"household/no_of_people_household": "12",
	"household/sanitation_ownership": "owned",
	"household/type_of_sanitation": "FL",
	"household/water_sources": "BW",
	"identity_consent/cam_account": "pao_sam",
	"identity_consent/country": "KHM",
	"identity_consent/identity_document": "BC",
	"identity_consent/organization": "TGF",
	"identity_consent/personal_id_no": "12312",
	"identity_consent/questions_to_be_asked": "Both",
	"identity_consent/region": "_",
	"identity_consent/town": "_",
	"personal_info/address_line_1": "Riam address1",
	"personal_info/address_line_2": "Siam address 2",
	"personal_info/civil_status": "SI",
	"personal_info/currency": "KHR",
	"personal_info/date_of_birth": "1980-03-19",
	"personal_info/first_name": "Siam",
	"personal_info/gender": "F",
	"personal_info/household_monthly_income": "12000",
	"personal_info/is_currently_earning": "Y",
	"personal_info/last_name": "Ream",
	"personal_info/postal_code": "P9200",
	"personal_info/source_of_income": "EMP FAM PEN",
	"personal_info/type_of_registration": "S",
	"personal_info/work_nature": "AGR",
	"pregnancy/ANC_visits": "3",
	"pregnancy/Are_you_taking_ferro_hate_with_folic_acid": "Y",
	"pregnancy/female_no_of_children": "3",
	"pregnancy/is_first_pregnancy": "Y",
	"pregnancy/is_pregnant_or_have_children": "P",
	"pregnancy/months_pregnant": "9",
	"pregnancy/not_rec_ANC_local_health_cente": "PEQ DIS",
	"pregnancy/place_receive_ANC": "GH",
	"pregnancy/vaccinated_tetanus_toxoid": "TT1",
	"pregnancy/where_to_deliver_baby": "HME NH",
	"pregnancy/why_not_delivr_health_centr": "PEQ PST NC",
	"start": "2019-03-26T11:40:06.860+08:00"
}